{
  "@context": "https://obligationfirst.org/v1/context.jsonld",
  "@type": "of:Proceeding",
  "@id": "https://obligationfirst.org/v1/examples/colorado-sb24-205/proceeding/federal-litigation",
  "title": "Federal litigation challenging Colorado SB 24-205 enforcement",
  "filed_date": "2025-09-01",
  "issuedBy": "https://obligationfirst.org/v1/examples/colorado-sb24-205/authority/federal-district-court",
  "jurisdiction": {
    "@type": "of:Jurisdiction",
    "territorial_scope": [
      "us"
    ]
  },
  "hasAllegation": [
    "https://obligationfirst.org/v1/examples/colorado-sb24-205/allegation/enforcement-challenge"
  ],
  "hasDetermination": [
    "https://obligationfirst.org/v1/examples/colorado-sb24-205/determination/stay-order"
  ],
  "notes": "Plaintiffs challenged the AG's authority to enforce SB 24-205 absent rulemaking. Federal court ordered enforcement stay until final rules are adopted. Filed_date is illustrative; this is a teaching construct with no adopter counterpart."
}
