{
  "@context": "https://obligationfirst.org/v1/context.jsonld",
  "@type": "of:Proceeding",
  "@id": "https://obligationfirst.org/v1/examples/air-canada/proceeding/moffatt",
  "title": "Moffatt v. Air Canada",
  "citation": "2024 BCCRT 149",
  "neutral_citation": "2024 BCCRT 149",
  "filed_date": "2024-02-14",
  "heardBy": ["https://obligationfirst.org/v1/examples/air-canada/authority/bccrt"],
  "parties": [
    "https://obligationfirst.org/v1/examples/air-canada/party/moffatt",
    "https://obligationfirst.org/v1/examples/air-canada/party/air-canada"
  ],
  "actor_roles": [
    { "party": "https://obligationfirst.org/v1/examples/air-canada/party/moffatt", "role": "claimant" },
    { "party": "https://obligationfirst.org/v1/examples/air-canada/party/air-canada", "role": "respondent" }
  ],
  "hasAllegation": [
    "https://obligationfirst.org/v1/examples/air-canada/allegation/moffatt-misrep",
    "https://obligationfirst.org/v1/examples/air-canada/allegation/moffatt-reliance"
  ],
  "hasDetermination": [
    "https://obligationfirst.org/v1/examples/air-canada/determination/moffatt-bccrt-149"
  ],
  "source": "https://canlii.org/en/bc/bccrt/doc/2024/2024bccrt149/2024bccrt149.html",
  "describesSameEntityAs": [
    "https://aiincidentlaw.org/proceeding/aiel-2024-001-proceeding.json"
  ]
}
