{
  "@context": "https://obligationfirst.org/v1/context.jsonld",
  "@type": "of:Proceeding",
  "@id": "https://obligationfirst.org/v1/examples/air-canada/proceeding/moffatt",
  "title": "Moffatt v. Air Canada",
  "citation": "2024 BCCRT 149",
  "neutral_citation": "2024 BCCRT 149",
  "filed_date": "2024-02-14",
  "issuedBy": "https://obligationfirst.org/v1/examples/air-canada/authority/bccrt",
  "hasAllegation": [
    "https://obligationfirst.org/v1/examples/air-canada/allegation/moffatt-misrep",
    "https://obligationfirst.org/v1/examples/air-canada/allegation/moffatt-reliance"
  ],
  "hasDetermination": [
    "https://obligationfirst.org/v1/examples/air-canada/determination/moffatt-bccrt-149"
  ],
  "source": "https://canlii.org/en/bc/bccrt/doc/2024/2024bccrt149/2024bccrt149.html",
  "sameAs": [
    "https://aiincidentlaw.org/proceeding/aiel-2024-001-proceeding.json"
  ]
}
